{
  "$schema": "https://publisher.genii.foundation/schemas/collection.schema.json",
  "schemaVersion": "1.0",
  "id": "after-dark",
  "title": "After Dark",
  "description": "Two brief records from the example station archive.",
  "publicationState": "published",
  "route": "/sequences/after-dark",
  "workIds": [
    "signal-lantern",
    "platform-bell"
  ]
}
